nohup: ignoring input
2025-11-02 12:32:47,307 - INFO - Starting experiment: exp1_baseline
2025-11-02 12:32:47,307 - INFO - Config: {'description': 'Baseline: Standard GAN with BCE loss'}
2025-11-02 12:32:47,787 - INFO - Discriminator LR: 0.0001, Generator LR: 0.0001
2025-11-02 12:32:53,524 - INFO - Epoch [0/10], Step [200/469], d_loss: 0.6176, g_loss: 1.1332, D(x): 0.90, D(G(z)): 0.39
2025-11-02 12:32:58,893 - INFO - Epoch [0/10], Step [400/469], d_loss: 0.3876, g_loss: 1.8936, D(x): 0.89, D(G(z)): 0.22
2025-11-02 12:33:06,154 - INFO - Epoch [1/10], Step [200/469], d_loss: 0.2644, g_loss: 3.3548, D(x): 0.93, D(G(z)): 0.15
2025-11-02 12:33:11,548 - INFO - Epoch [1/10], Step [400/469], d_loss: 0.4279, g_loss: 4.0359, D(x): 0.92, D(G(z)): 0.24
2025-11-02 12:33:18,760 - INFO - Epoch [2/10], Step [200/469], d_loss: 0.2673, g_loss: 3.7264, D(x): 0.88, D(G(z)): 0.04
2025-11-02 12:33:24,194 - INFO - Epoch [2/10], Step [400/469], d_loss: 0.8242, g_loss: 3.3365, D(x): 0.71, D(G(z)): 0.02
2025-11-02 12:33:31,525 - INFO - Epoch [3/10], Step [200/469], d_loss: 0.6422, g_loss: 1.9943, D(x): 0.73, D(G(z)): 0.04
2025-11-02 12:33:36,971 - INFO - Epoch [3/10], Step [400/469], d_loss: 0.3980, g_loss: 2.9391, D(x): 0.88, D(G(z)): 0.17
2025-11-02 12:33:44,247 - INFO - Epoch [4/10], Step [200/469], d_loss: 0.3362, g_loss: 3.3493, D(x): 0.91, D(G(z)): 0.18
2025-11-02 12:33:49,747 - INFO - Epoch [4/10], Step [400/469], d_loss: 0.3348, g_loss: 3.1334, D(x): 0.88, D(G(z)): 0.12
2025-11-02 12:33:56,705 - INFO - Epoch [5/10], Step [200/469], d_loss: 0.4983, g_loss: 2.4857, D(x): 0.79, D(G(z)): 0.11
2025-11-02 12:34:01,595 - INFO - Epoch [5/10], Step [400/469], d_loss: 0.4791, g_loss: 2.7864, D(x): 0.86, D(G(z)): 0.22
2025-11-02 12:34:08,304 - INFO - Epoch [6/10], Step [200/469], d_loss: 0.4216, g_loss: 2.8426, D(x): 0.86, D(G(z)): 0.17
2025-11-02 12:34:13,211 - INFO - Epoch [6/10], Step [400/469], d_loss: 0.4775, g_loss: 4.1179, D(x): 0.92, D(G(z)): 0.26
2025-11-02 12:34:19,821 - INFO - Epoch [7/10], Step [200/469], d_loss: 0.4962, g_loss: 2.8655, D(x): 0.82, D(G(z)): 0.13
2025-11-02 12:34:25,006 - INFO - Epoch [7/10], Step [400/469], d_loss: 0.3814, g_loss: 2.7718, D(x): 0.85, D(G(z)): 0.14
2025-11-02 12:34:31,644 - INFO - Epoch [8/10], Step [200/469], d_loss: 0.3632, g_loss: 2.6815, D(x): 0.83, D(G(z)): 0.10
2025-11-02 12:34:36,710 - INFO - Epoch [8/10], Step [400/469], d_loss: 0.3037, g_loss: 3.6525, D(x): 0.87, D(G(z)): 0.10
2025-11-02 12:34:43,357 - INFO - Epoch [9/10], Step [200/469], d_loss: 0.3788, g_loss: 3.1320, D(x): 0.88, D(G(z)): 0.12
2025-11-02 12:34:48,335 - INFO - Epoch [9/10], Step [400/469], d_loss: 0.3054, g_loss: 3.5552, D(x): 0.90, D(G(z)): 0.10
2025-11-02 12:34:50,055 - INFO - Saved checkpoint at epoch 10
2025-11-02 12:34:50,629 - INFO - Calculating FID score...
2025-11-02 12:34:57,296 - INFO - FID计算完成: 354.64
2025-11-02 12:34:57,300 - INFO - Analyzing latent space...
2025-11-02 12:34:57,354 - INFO - Saved final models to saved_models
2025-11-02 12:34:57,354 - INFO - Experiment exp1_baseline completed. FID: 354.64
2025-11-02 12:34:57,360 - INFO - Starting experiment: exp2_g_larger_lr
2025-11-02 12:34:57,360 - INFO - Config: {'d_lr': 0.0001, 'g_lr': 0.0004, 'description': 'LR: G_lr > D_lr (1:4 ratio)'}
2025-11-02 12:34:57,426 - INFO - Discriminator LR: 0.0001, Generator LR: 0.0004
2025-11-02 12:35:02,833 - INFO - Epoch [0/10], Step [200/469], d_loss: 1.1062, g_loss: 0.8716, D(x): 0.67, D(G(z)): 0.49
2025-11-02 12:35:08,130 - INFO - Epoch [0/10], Step [400/469], d_loss: 1.0110, g_loss: 0.8479, D(x): 0.70, D(G(z)): 0.47
2025-11-02 12:35:15,200 - INFO - Epoch [1/10], Step [200/469], d_loss: 0.8967, g_loss: 1.3236, D(x): 0.79, D(G(z)): 0.43
2025-11-02 12:35:20,483 - INFO - Epoch [1/10], Step [400/469], d_loss: 0.8812, g_loss: 1.3571, D(x): 0.77, D(G(z)): 0.40
2025-11-02 12:35:27,559 - INFO - Epoch [2/10], Step [200/469], d_loss: 1.1200, g_loss: 1.0111, D(x): 0.69, D(G(z)): 0.49
2025-11-02 12:35:32,891 - INFO - Epoch [2/10], Step [400/469], d_loss: 1.2116, g_loss: 0.9015, D(x): 0.57, D(G(z)): 0.47
2025-11-02 12:35:40,120 - INFO - Epoch [3/10], Step [200/469], d_loss: 0.9958, g_loss: 1.2170, D(x): 0.65, D(G(z)): 0.41
2025-11-02 12:35:45,409 - INFO - Epoch [3/10], Step [400/469], d_loss: 1.0937, g_loss: 1.0219, D(x): 0.57, D(G(z)): 0.40
2025-11-02 12:35:52,460 - INFO - Epoch [4/10], Step [200/469], d_loss: 1.1438, g_loss: 1.2194, D(x): 0.61, D(G(z)): 0.44
2025-11-02 12:35:57,711 - INFO - Epoch [4/10], Step [400/469], d_loss: 1.2919, g_loss: 1.1233, D(x): 0.50, D(G(z)): 0.39
2025-11-02 12:36:04,967 - INFO - Epoch [5/10], Step [200/469], d_loss: 1.2449, g_loss: 1.1781, D(x): 0.60, D(G(z)): 0.48
2025-11-02 12:36:10,272 - INFO - Epoch [5/10], Step [400/469], d_loss: 1.2042, g_loss: 1.1591, D(x): 0.59, D(G(z)): 0.44
2025-11-02 12:36:17,517 - INFO - Epoch [6/10], Step [200/469], d_loss: 1.2076, g_loss: 1.0019, D(x): 0.55, D(G(z)): 0.42
2025-11-02 12:36:22,852 - INFO - Epoch [6/10], Step [400/469], d_loss: 1.2106, g_loss: 1.0904, D(x): 0.62, D(G(z)): 0.50
2025-11-02 12:36:29,823 - INFO - Epoch [7/10], Step [200/469], d_loss: 1.3704, g_loss: 0.9308, D(x): 0.55, D(G(z)): 0.51
2025-11-02 12:36:35,146 - INFO - Epoch [7/10], Step [400/469], d_loss: 1.3191, g_loss: 0.9261, D(x): 0.52, D(G(z)): 0.45
2025-11-02 12:36:42,377 - INFO - Epoch [8/10], Step [200/469], d_loss: 1.3526, g_loss: 0.8592, D(x): 0.56, D(G(z)): 0.51
2025-11-02 12:36:47,865 - INFO - Epoch [8/10], Step [400/469], d_loss: 1.3403, g_loss: 0.8237, D(x): 0.50, D(G(z)): 0.46
2025-11-02 12:36:55,114 - INFO - Epoch [9/10], Step [200/469], d_loss: 1.3152, g_loss: 0.8499, D(x): 0.53, D(G(z)): 0.47
2025-11-02 12:37:00,513 - INFO - Epoch [9/10], Step [400/469], d_loss: 1.3853, g_loss: 0.8092, D(x): 0.50, D(G(z)): 0.48
2025-11-02 12:37:02,220 - INFO - Saved checkpoint at epoch 10
2025-11-02 12:37:02,768 - INFO - Calculating FID score...
2025-11-02 12:37:10,441 - INFO - FID计算完成: 260.30
2025-11-02 12:37:10,444 - INFO - Analyzing latent space...
2025-11-02 12:37:10,481 - INFO - Saved final models to saved_models
2025-11-02 12:37:10,481 - INFO - Experiment exp2_g_larger_lr completed. FID: 260.30
2025-11-02 12:37:10,486 - INFO - Starting experiment: exp3_g_smaller_lr
2025-11-02 12:37:10,486 - INFO - Config: {'d_lr': 0.0004, 'g_lr': 0.0001, 'description': 'LR: G_lr < D_lr (1:4 ratio)'}
2025-11-02 12:37:10,534 - INFO - Discriminator LR: 0.0004, Generator LR: 0.0001
2025-11-02 12:37:15,789 - INFO - Epoch [0/10], Step [200/469], d_loss: 0.0121, g_loss: 4.8542, D(x): 1.00, D(G(z)): 0.01
2025-11-02 12:37:21,155 - INFO - Epoch [0/10], Step [400/469], d_loss: 0.0521, g_loss: 4.7787, D(x): 0.98, D(G(z)): 0.03
2025-11-02 12:37:28,344 - INFO - Epoch [1/10], Step [200/469], d_loss: 0.0873, g_loss: 3.4011, D(x): 0.98, D(G(z)): 0.03
2025-11-02 12:37:33,651 - INFO - Epoch [1/10], Step [400/469], d_loss: 0.1036, g_loss: 7.1933, D(x): 0.98, D(G(z)): 0.06
2025-11-02 12:37:40,783 - INFO - Epoch [2/10], Step [200/469], d_loss: 0.5483, g_loss: 5.3111, D(x): 0.85, D(G(z)): 0.00
2025-11-02 12:37:46,066 - INFO - Epoch [2/10], Step [400/469], d_loss: 4.1124, g_loss: 22.2357, D(x): 0.63, D(G(z)): 0.00
2025-11-02 12:37:53,260 - INFO - Epoch [3/10], Step [200/469], d_loss: 0.0365, g_loss: 3.7401, D(x): 1.00, D(G(z)): 0.03
2025-11-02 12:37:58,589 - INFO - Epoch [3/10], Step [400/469], d_loss: 0.0839, g_loss: 5.3357, D(x): 0.97, D(G(z)): 0.02
2025-11-02 12:38:05,779 - INFO - Epoch [4/10], Step [200/469], d_loss: 0.1552, g_loss: 4.1416, D(x): 0.95, D(G(z)): 0.04
2025-11-02 12:38:11,115 - INFO - Epoch [4/10], Step [400/469], d_loss: 0.2052, g_loss: 3.5967, D(x): 0.93, D(G(z)): 0.08
2025-11-02 12:38:18,265 - INFO - Epoch [5/10], Step [200/469], d_loss: 0.3736, g_loss: 4.1544, D(x): 0.88, D(G(z)): 0.03
2025-11-02 12:38:23,510 - INFO - Epoch [5/10], Step [400/469], d_loss: 0.2242, g_loss: 3.2527, D(x): 0.93, D(G(z)): 0.10
2025-11-02 12:38:30,586 - INFO - Epoch [6/10], Step [200/469], d_loss: 0.2098, g_loss: 2.5121, D(x): 0.90, D(G(z)): 0.03
2025-11-02 12:38:35,828 - INFO - Epoch [6/10], Step [400/469], d_loss: 0.3158, g_loss: 5.2561, D(x): 0.94, D(G(z)): 0.17
2025-11-02 12:38:42,962 - INFO - Epoch [7/10], Step [200/469], d_loss: 0.2020, g_loss: 4.1952, D(x): 0.92, D(G(z)): 0.06
2025-11-02 12:38:48,225 - INFO - Epoch [7/10], Step [400/469], d_loss: 0.4414, g_loss: 4.5314, D(x): 0.82, D(G(z)): 0.01
2025-11-02 12:38:55,348 - INFO - Epoch [8/10], Step [200/469], d_loss: 0.2488, g_loss: 4.9756, D(x): 0.97, D(G(z)): 0.16
2025-11-02 12:39:00,615 - INFO - Epoch [8/10], Step [400/469], d_loss: 0.1915, g_loss: 4.4316, D(x): 0.91, D(G(z)): 0.06
2025-11-02 12:39:07,695 - INFO - Epoch [9/10], Step [200/469], d_loss: 0.2510, g_loss: 4.1035, D(x): 0.90, D(G(z)): 0.04
2025-11-02 12:39:12,974 - INFO - Epoch [9/10], Step [400/469], d_loss: 0.2075, g_loss: 4.6230, D(x): 0.92, D(G(z)): 0.02
2025-11-02 12:39:14,810 - INFO - Saved checkpoint at epoch 10
2025-11-02 12:39:15,486 - INFO - Calculating FID score...
2025-11-02 12:39:21,515 - INFO - FID计算完成: 287.45
2025-11-02 12:39:21,519 - INFO - Analyzing latent space...
2025-11-02 12:39:21,564 - INFO - Saved final models to saved_models
2025-11-02 12:39:21,565 - INFO - Experiment exp3_g_smaller_lr completed. FID: 287.45
2025-11-02 12:39:21,570 - INFO - Starting experiment: exp4_equal_lr
2025-11-02 12:39:21,570 - INFO - Config: {'d_lr': 0.0002, 'g_lr': 0.0002, 'description': 'LR: G_lr = D_lr (balanced)'}
2025-11-02 12:39:21,616 - INFO - Discriminator LR: 0.0002, Generator LR: 0.0002
2025-11-02 12:39:27,063 - INFO - Epoch [0/10], Step [200/469], d_loss: 0.3721, g_loss: 1.9352, D(x): 0.94, D(G(z)): 0.26
2025-11-02 12:39:32,369 - INFO - Epoch [0/10], Step [400/469], d_loss: 0.1136, g_loss: 4.5047, D(x): 0.97, D(G(z)): 0.08
2025-11-02 12:39:39,533 - INFO - Epoch [1/10], Step [200/469], d_loss: 0.3801, g_loss: 2.5398, D(x): 0.86, D(G(z)): 0.16
2025-11-02 12:39:44,755 - INFO - Epoch [1/10], Step [400/469], d_loss: 0.5526, g_loss: 2.4435, D(x): 0.81, D(G(z)): 0.20
2025-11-02 12:39:51,865 - INFO - Epoch [2/10], Step [200/469], d_loss: 0.5617, g_loss: 3.8852, D(x): 0.78, D(G(z)): 0.02
2025-11-02 12:39:57,131 - INFO - Epoch [2/10], Step [400/469], d_loss: 0.2329, g_loss: 3.4087, D(x): 0.91, D(G(z)): 0.09
2025-11-02 12:40:04,271 - INFO - Epoch [3/10], Step [200/469], d_loss: 0.5412, g_loss: 2.8493, D(x): 0.84, D(G(z)): 0.21
2025-11-02 12:40:09,547 - INFO - Epoch [3/10], Step [400/469], d_loss: 0.7038, g_loss: 2.9692, D(x): 0.72, D(G(z)): 0.03
2025-11-02 12:40:16,792 - INFO - Epoch [4/10], Step [200/469], d_loss: 0.5282, g_loss: 3.2667, D(x): 0.87, D(G(z)): 0.27
2025-11-02 12:40:22,113 - INFO - Epoch [4/10], Step [400/469], d_loss: 0.6245, g_loss: 3.9770, D(x): 0.90, D(G(z)): 0.33
2025-11-02 12:40:29,375 - INFO - Epoch [5/10], Step [200/469], d_loss: 0.6764, g_loss: 2.4464, D(x): 0.72, D(G(z)): 0.06
2025-11-02 12:40:34,697 - INFO - Epoch [5/10], Step [400/469], d_loss: 0.5665, g_loss: 1.8290, D(x): 0.75, D(G(z)): 0.15
2025-11-02 12:40:41,991 - INFO - Epoch [6/10], Step [200/469], d_loss: 0.6009, g_loss: 3.2214, D(x): 0.85, D(G(z)): 0.29
2025-11-02 12:40:47,332 - INFO - Epoch [6/10], Step [400/469], d_loss: 0.4586, g_loss: 2.3229, D(x): 0.82, D(G(z)): 0.14
2025-11-02 12:40:54,542 - INFO - Epoch [7/10], Step [200/469], d_loss: 0.5891, g_loss: 2.0082, D(x): 0.78, D(G(z)): 0.17
2025-11-02 12:40:59,838 - INFO - Epoch [7/10], Step [400/469], d_loss: 0.8479, g_loss: 1.8379, D(x): 0.61, D(G(z)): 0.03
2025-11-02 12:41:07,192 - INFO - Epoch [8/10], Step [200/469], d_loss: 1.1469, g_loss: 1.7087, D(x): 0.53, D(G(z)): 0.07
2025-11-02 12:41:12,589 - INFO - Epoch [8/10], Step [400/469], d_loss: 0.6148, g_loss: 2.0973, D(x): 0.78, D(G(z)): 0.22
2025-11-02 12:41:19,916 - INFO - Epoch [9/10], Step [200/469], d_loss: 0.9228, g_loss: 1.7576, D(x): 0.62, D(G(z)): 0.14
2025-11-02 12:41:25,293 - INFO - Epoch [9/10], Step [400/469], d_loss: 0.8208, g_loss: 2.0137, D(x): 0.67, D(G(z)): 0.16
2025-11-02 12:41:27,131 - INFO - Saved checkpoint at epoch 10
2025-11-02 12:41:27,653 - INFO - Calculating FID score...
2025-11-02 12:41:34,351 - INFO - FID计算完成: 268.85
2025-11-02 12:41:34,354 - INFO - Analyzing latent space...
2025-11-02 12:41:34,404 - INFO - Saved final models to saved_models
2025-11-02 12:41:34,404 - INFO - Experiment exp4_equal_lr completed. FID: 268.85
2025-11-02 12:41:34,409 - INFO - 
=== EXPERIMENT SUMMARY ===
2025-11-02 12:41:34,409 - INFO - exp1_baseline             | FID: 354.64 | Final D-Loss: 0.3355 | G-Loss: 3.7775 | Desc: Baseline: Standard G...
2025-11-02 12:41:34,409 - INFO - exp2_g_larger_lr          | FID: 260.30 | Final D-Loss: 1.3240 | G-Loss: 0.8480 | Desc: LR: G_lr > D_lr (1:4...
2025-11-02 12:41:34,409 - INFO - exp3_g_smaller_lr         | FID: 287.45 | Final D-Loss: 0.3514 | G-Loss: 3.7948 | Desc: LR: G_lr < D_lr (1:4...
2025-11-02 12:41:34,409 - INFO - exp4_equal_lr             | FID: 268.85 | Final D-Loss: 0.8063 | G-Loss: 2.1557 | Desc: LR: G_lr = D_lr (bal...
2025-11-02 12:41:34,409 - INFO - 
All models saved to: saved_models
2025-11-02 12:41:34,409 - INFO - All experiments completed!
